,speaker,preprocessed
188,Biden,"Here's the point, the point is that that's why he keeps trying to rile everything up. He doesn't want to calm things down instead of going in and talking to people and saying, Let's get everybody together. Figure out how to deal with this. What's he do? He just pours gasoline in the fire constantly and every single solitary time."
189,Biden,"Say it, do it say it."
190,Biden,"He's own FBI Director said unlike white supremacist, Antifa is an idea not an organization-"
191,Biden,... not a militia. That's what his FBI Director said.
192,Biden,"Every body in your administration tells you the true, it's a bad idea. You have no idea about anything."
193,Biden,"Under this president, we become weaker, sicker, poor, more divided and more violent. When I was vice president, we inherited a recession. I was asked to fix it. I did. We left him a booming economy and he caused the recession. With regard to being weaker, the fact is that I've gone head to head with Putin and made it clear to him we're not going to take any of his stuff. He's Putin's puppy. He still refuses to even say anything to Putin about the bounty on the heads of American soldiers."
194,Biden,"By the way, my son..."
195,Biden,He never keeps his word.
196,Biden,Can you get back 30 seconds?
197,Biden,"So thirdly, we're poor. The billionaires have gotten much more wealthy by a tune of over $3- $400 billion more just since COVID. You in the home, you got less you're in more trouble than you were before. In terms of being more violent. When we were in office there were 15% less violence in America than there is today. He's President United States. It's on his watch. And with regard to more divided the nation, it can't stay divided. We can't be this way. And speaking of my son, the way you talk about the military, the way you talk about them being losers and being and just being suckers. My son was in Iraq. He spent a year there. He got the Brown Star. He got the Conspicuous Service Medal. He was not a loser. He was a Patriot and the people left behind there were heroes."
198,Biden,And I resent-
199,Biden,"I'm talking about my son, Beau Biden, you're talking about Hunter?"
200,Biden,That's not true he was not dishonorably discharged.
201,Biden,None of that is true.
202,Biden,That is not true.
203,Biden,"My son like a lot of people at home had a drug problem. He's overtaking it. He's fixed it. He's worked on it. And I'm proud of him, I'm proud of my son."
204,Biden,He wasn't given tens of millions of dollars.   It was all discredited.
205,Biden,That is not true. That report is totally discredited.
206,Biden,Mitt Romney on that committee said it wasn't worth taxpayer's money. That report was written for political reason.
207,Biden,So would I.
208,Biden,Why have you relaxed fuel economy standards that are going to create more pollution from cars and trucks?
209,Biden,"He's absolutely wrong, number one. Number two, if in fact, during our administration in the recovery act, I was in charge able to bring down the cost of renewable energy to cheaper than are as cheap as coal and gas and oil. Nobody's going to build another coal fired plant in America. No one's going to build another oil fire plant in America. They're going to move to renewable energy. Number one, number two, we're going to make sure that we are able to take the federal fleet and turn it into a fleet that's run on their electric vehicles. Making sure that we can do that, we're going to put 500,000 charging stations in all of the highways that we're going to be building in the future. We're going to build a economy that in fact is going to provide for the ability of us to take 4 million buildings and make sure that they in fact are weatherized in a way that in fact will they'll emit significantly less gas and oil because the heat will not be going out. There's so many things that we can do..."
210,Biden,"Gas and oil because the heat will not be going out. There's so many things that we can do now to create thousands and thousands of jobs. We can get to net zero, in terms of energy production, by 2035. Not only not costing people jobs, creating jobs, creating millions of good-paying jobs. Not 15 bucks an hour, but prevailing wage, by having a new infrastructure that in fact, is green. And the first thing I will do, I will rejoin the Paris Accord. I will join the Paris Accord because with us out of it, look what's happening. It's all falling apart. And talk about someone who has no relationship with foreign policy. The rainforests of Brazil are being torn down, are being ripped down. More carbon is absorbed in that rainforest than every bit of carbon that's emitted in the United States. Instead of doing something about that, I would be gathering up and making sure we had the countries of the world coming up with $20 billion, and say, Here's $20 billion. Stop tearing down the forest. And If you don't, then you're going to have significant economic consequences."
211,Biden,"Well, he hasn't drawn a line. He wants to make sure that methane's not a problem. You can now emit more methane without it being a problem. Methane. This is a guy who says that you don't have to have mileage standards for automobiles that exist now. This is the guy who says that, the fact that-"
212,Biden,It's all true. And here's the deal-
213,Biden,I'm talking about the Biden plan  -
214,Biden,No.
215,Biden,That is not-
216,Biden,Not true-
217,Biden,Not true.
218,Biden,Not true.
219,Biden,Simply... Look-
220,Biden,That is simply not the case-
221,Biden,"What it's going to do, it's going to create thousands and millions of jobs. Good paying jobs  ."
222,Biden,He doesn't know how to do that-
223,Biden,"The fact is, it's going to create millions of good paying jobs, and these tax incentives for people to weatherize, which he wants to get rid of. It's going to make the economy much safer. Look how much we're paying now to deal with the hurricanes, deal with... By the way, he has an answer for hurricanes. He said, maybe we should drop a nuclear weapon on them, and they may-"
224,Biden,"Yeah, he did say that-"
225,Biden,And here's the deal-
226,Biden,"... we're going to be in a position where we can create hard, hard, good jobs by making sure the environment is clean, and we all are in better shape. We spend billions of dollars now, billions of dollars, on floods, hurricanes, rising seas. We're in real trouble. Look what's happened just in the Midwest with these storms that come through and wipe out entire sections and counties in Iowa. They didn't happen before. They're because of global warming. We make up 15% of the world's problem. But the rest of the world, we've got to get them to come along. That's why we have to get back into the Paris Accord."
227,Biden,For 47-
228,Biden,That is not my plan  . The Green New Deal   is not my plan.  -
229,Biden,I did not say that-
230,Biden,Play it. Play it-
231,Biden,"The final question is, I can't remember which of all his rantings  ."
232,Biden,Yeah.
233,Biden,The economy-
234,Biden,"The Green New Deal will pay for itself as we move forward. We're not going to build plants that, in fact, are great polluting plants-"
235,Biden,Pardon me?
236,Biden,"No, I don't support the Green New Deal."
237,Biden,I support  -
238,Biden,I support   the Biden plan that I put forward.
239,Biden,"The Biden plan, which is different than what he calls the radical Green New Deal."
240,Biden,"Prepare to let people vote. They should go to iwillvote.com, decide how they're going to vote, when they're going to vote, and what means by which they're going to vote. His own Homeland Security director, and as well as the FBI director, says that there is no evidence at all that mail-in ballots are a source of being manipulated and cheating. They said that. The fact is that there are going to be millions of people because of COVID that are going to be voting by mail-in ballots like he does, by the way. He sits behind the Resolute Desk and sends his ballot to Florida, number one. Number two, we're going to make sure that those people who want to vote in person are able to vote because there are enough poll watchers are there to make sure they can socially distance. The polls are open on time, and the polls stay open until the votes are counted. And this is all about trying to dissuade people from voting because he's trying to scare people into thinking that it's not going to be legitimate."
241,Biden,"Show up and vote. You will determine the outcome of this election. Vote, vote, vote. If you're able to vote early in your state, vote early. If you're able to vote in person, vote in person. Vote whatever way is the best way for you, because you will... He cannot stop you from being able to determine the outcome of this election. And in terms of whether or not... When the votes are counted and they're all counted, that will be accepted. If I win, that will be accepted. If I lose, that'll be accepted. But by the way, if in fact he says, he's not sure what he's going to accept. Well, let me tell you something, it doesn't matter, because if we get the votes, it's going to be all over. He's going to go. He can't stay in power. It won't happen. It won't happen, so vote. Just make sure you understand, you have it in your control to determine what this country is going to look like the next four years. Is it going to change, or are you going to get four more years of these lies?"
242,Biden,There is no  ... There is no evidence of that-
243,Biden,There is no evidence of that-
244,Biden,"Five states have had mail-in ballots for the last decade or more. Five, including two Republican states. And you don't have to solicit the ballot. It's sent to you. It's sent to your home. What they're saying is that it has to be a postmark by election day. If it doesn't get in until the seventh, eighth, ninth, it still should be counted. He's just afraid of counting the votes-"
245,Biden,"I am concerned that any court would settle this, because here's the deal. When you get a ballot and you fill it out, you're supposed to have an affidavit. If you didn't know, you have someone say that, this is me. You should be able to, if in fact you can verify that's you before the ballot is thrown out, that's sufficient to be able to count the ballot because someone made a mistake and not dotting the correct I. Who they voted for, testify, say who they voted for, say it's you. That is totally legitimate."
246,Biden,Mail service delivers   185 million pieces of mail a day  -
247,Biden,"Yes. And here's the deal. We count the ballots, as you pointed out. Some of these ballots in some states can't even be opened until election day. And if there's thousands of ballots, it's going to take time to do it. And by the way, our military... They've been voting by ballots since the end of the Civil War, in effect. And that's what's going to happen. Why is it, for them, somehow not fraudulent. It's the same process. It's honest. No one has established at all that there is fraud related to mail-in ballots, that somehow it's a fraudulent process."
248,Biden,"He has no idea what he's talking about. Here's the deal. The fact is, I will accept it, and he will too. You know why? Because once the winner is declared after all the ballots are counted, all the votes are counted, that'll be the end of it. That'll be the end of it. And if it's me, in fact, fine. If it's not me, I'll support the outcome. And I'll be a president, not just for the Democrats. I'll be a president for Democrats and Republicans. And this guy-"
