,speaker,preprocessed
0,Biden,"How you doing, man?"
1,Biden,I'm well.
2,Biden,"Well, first of all, thank you for doing this and looking forward to this, Mr. President."
3,Biden,The American people have a right to have a say in who the Supreme Court nominee is and that say occurs when they vote for United States Senators and when they vote for the President of United States. They're not going to get that chance now because we're in the middle of an election already. The election has already started. Tens of thousands of people already voted and so the thing that should happen is we should wait. We should wait and see what the outcome of this election is because that's the only way the American people get to express their view is by who they elect as President and who they elect as Vice President.
4,Biden,"Now, what's at stake here is the President's made it clear, he wants to get rid of the Affordable Care Act. He's been running on that, he ran on that and he's been governing on that. He's in the Supreme Court right now trying to get rid of the Affordable Care Act, which will strip 20 million people from having health insurance now, if it goes into court. And the justice, I'm not opposed to the justice, she seems like a very fine person. But she's written, before she went in the bench, which is her right, that she thinks that the Affordable Care Act is not Constitutional. The other thing that's on the court, and if it's struck down, what happens? Women's rights are fundamentally changed. Once again, a woman could pay more money because she has a pre-existing condition of pregnancy. They're able to charge women more for the same exact procedure a man gets."
5,Biden,"And that ended when we, in fact, passed the Affordable Care Act, and there's a hundred million people who have pre-existing conditions and they'll be taken away as well. Those pre-existing conditions, insurance companies are going to love this. And so it's just not appropriate to do this before this election. If he wins the election and the Senate is Republican, then he goes forward. If not, we should wait until February."
6,Biden,He's elected to the next election.
7,Biden,That's simply not true.
8,Biden,Open discussion.
9,Biden,"Number one, he knows what I proposed. What I proposed is that we expand Obamacare and we increase it. We do not wipe any. And one of the big debates we had with 23 of my colleagues trying to win the nomination that I won, were saying that Biden wanted to allow people to have private insurance still. They can. They do. They will under my proposal."
10,Biden,That is simply a lie.
11,Biden,"The party is me. Right now, I am the Democratic Party."
12,Biden,I am the Democratic Party right now.
13,Biden,"The platform of the Democratic Party is what I, in fact, approved of, what I approved of. Now, here's the deal. The deal is that it's going to wipe out pre-existing conditions. And, by the way, the 200,000 people that have died on his watch, how many of those have survived? Well, there's seven million people that contracted COVID. What does it mean for them going forward if you strike down the Affordable Care Act?"
14,Biden,I'm happy to talk about this.
15,Biden,You're not going to be able to shut him up.
16,Biden,"Let me finish. The point is that the President also is opposed to Roe V. Wade. That's on the ballot as well and the court, in the court, and so that's also at stake right now. And so the election is all-"
17,Biden,It's on the ballot in the court.
18,Biden,In the court.
19,Biden,Donald would you just be quiet for a minute.
20,Biden,All right.
21,Biden,Good healthcare.
22,Biden,He has not done healthcare.
23,Biden,Yes.
24,Biden,It is not.
25,Biden,"It does not. It's only for those people who are so poor they qualify for Medicaid they can get that free in most States, except Governors who want to deny people who are poor Medicaid. Anyone who qualifies for Medicaid would automatically be enrolled in the public option. The vast majority of the American people would still not be in that option. Number one. Number two."
26,Biden,"Look, hey."
27,Biden,I'm not going to listen to him. The fact of the matter is I beat Bernie Sanders.
28,Biden,I beat him by a whole hell of a lot.
29,Biden,"I'm here standing facing you, old buddy."
30,Biden,All he knows how to do-
31,Biden,Look he's the deal. I got very lucky. I'm going to get very lucky tonight as well.
32,Biden,And tonight I'm going to make sure.
33,Biden,"Because here's the deal, here's the deal. The fact is that everything he's saying so far is simply a lie. I'm not here to call out his lies. Everybody knows he's a liar."
34,Biden,"God, I want to make sure-"
35,Biden,"No, he doesn't know how to do that."
36,Biden,"The wrong guy, the wrong night, at the wrong time."
37,Biden,"There is no manifesto, number one."
38,Biden,Number two.
39,Biden,Number two.
40,Biden,"I'll tell you what, he is not for any help for people needing healthcare."
41,Biden,"Because he, in fact, already has costs 10 million people their healthcare that they had from their employers because of his recession. Number one. Number two, there are 20 million people getting healthcare through Obamacare now that he wants to take it away. He won't ever look you in the eye and say that's what he wants to do. Take it away."
42,Biden,He doesn't know how. He doesn't know how to do that.
43,Biden,He has never offered a plan.
44,Biden,He has no plan for healthcare.
45,Biden,"He sends out wishful thinking. He has Executive Orders that have no power. He hasn't lowered drug costs for anybody. He's been promising a healthcare plan since he got elected. He has none, like almost everything else he talks about. He does not have a plan. He doesn't have a plan. And the fact is this man doesn't know what he's talking about.  ."
46,Biden,Sure.
47,Biden,"Whatever position I take on that, that'll become the issue. The issue is the American people should speak. You should go out and vote. You're voting now. Vote and let your Senators know strongly how you feel."
48,Biden,Vote now.
49,Biden,"Make sure you, in fact, let people know, your Senators."
50,Biden,I'm not going to answer the question.
51,Biden,"Will you shut up, man?"
52,Biden,This is so un-Presidential.
53,Biden,"That was really a productive segment, wasn't it? Keep yapping, man."
54,Biden,They sure do.
55,Biden,"Good luck. 200,000 dead. As you said, over seven million infected in the United States. We, in fact, have 4% of the world's population, 20% of the deaths. 40,000 people a day are contracting COVID. In addition to that, about between 750 and 1000 people a day are dying. When he was presented with that number, he said, It is what it is. Well, it is what it is because you are who you are. That's why it is. The President has no plan. He hasn't laid out anything. He knew all the way back in February how serious this crisis was. He knew it was a deadly disease. What did he do? He's on tape as acknowledging he knew it. He said he didn't tell us or give people a warning of it because he didn't want to panic the American people. You don't panic. He panicked. In addition to that, what did he do?"
56,Biden,He went in and we were insisting that the people we had in the ground in China should be able to go to Wuhan and determine for themselves how dangerous this was. He did not even ask Xi to do that.
57,Biden,He told us what a great job Xi was doing. He said we owe him debt of gratitude for being so transparent with us. And what did he do then? He then did nothing. He waited and waited and waited. He still doesn't have a plan.
58,Biden,"I laid out back in March, exactly what we should be doing. And I laid out again in July, what we should be doing. We should be providing all the protective gear possible. We should be providing the money the House has passed in order to be able to go out and get people the help they need to keep their businesses open. Open schools cost a lot of money. You should get out of your bunker and get out of the sand trap in your golf course and go in the Oval Office and bring together the Democrats and Republicans and fund what needs to be done now to save lives."
59,Biden,I know how to do the job. I know how to get the job done.
60,Biden,"14,000 people died, not 200,000."
61,Biden,"And there was no one ... We didn't shut down the economy. This is his economy he shut down. The reason it's shut down is because, look, you folks at home. How many of you got up this morning and had an empty chair at the kitchen table because someone died of COVID? How many of you are in a situation where you lost your mom or dad and you couldn't even speak to them, you had a nurse holding a phone up so you could in fact say goodbye?"
62,Biden,"His own CDC Director says we could lose as many as another 200,000 people between now and the end of the year. And he said, if we just wear a mask, we can save half those numbers. Just a mask. And by the way, in terms of the whole notion of a vaccine, we're for a vaccine, but I don't trust him at all. Nor do you. I know you don't. What we trust is a scientist."
63,Biden,God.
64,Biden,This is the same man who told you-
65,Biden,"... by Easter, this would be gone away. By the warm weather, it'd be gone. Miraculous, like a miracle. And by the way, maybe you could inject some bleach in your arm, and that would take care of it. This is the same man."
66,Biden,"So here's the deal. This man is talking about a vaccine. Every serious company is talking about maybe having a vaccine done by the end of the year, but the distribution of that vaccine will not occur until sometime beginning of the middle of next year to get it out, if we get the vaccine. And pray God we will. Pray God we will."
67,Biden,No more than the question you just asked him. You pointed out he puts pressure and disagrees with his own scientists.
68,Biden,Everybody knows-
69,Biden,"Well, no, no. You can trust the scientist. She didn't say that. You can trust the-"
70,Biden,"Yes. Well, that's what he's going to try to do, but there's thousands of scientists out there, like here at this great hospital that don't work for him. Their job doesn't depend on him. They're the people... And by the way-"
71,Biden,By the way-
72,Biden,"Do you believe for a moment what he's telling you in light of all the lies he's told you about the whole issue relating to COVID? He still hasn't even acknowledged that he knew this was happening, knew how dangerous it was going to be back in February, and he didn't even tell you. He's on record as saying it. He panicked or he just looked at the stock market. One of the two. Because guess what? A lot of people died and a lot more are going to die unless he gets a lot smarter, a lot quicker-"
73,Biden,"Oh, give me a break."
74,Biden,"Well, let's have this debate-"
75,Biden,"Because he doesn't have a plan. If I were running it, I'd know what the plan is. You've got to provide these businesses the ability to have the money to be able to reopen with the PPE, as well as with the sanitation they need. You have to provide them classic-"
76,Biden,Will he just shush for a minute?
77,Biden,"Nancy Pelosi and Schumer, they have a plan. He won't even meet with them. The Republicans won't meet in the Senate. He sits in his golf course. Well, I mean, literally, think about it. Think about it."
78,Biden,You just admitted you'd shut it down.
79,Biden,I got to respond to that.
80,Biden,I got to respond to that.
81,Biden,Just like your rally.
82,Biden,"Look, the way to open businesses is give them the wherewithal to be able open. We provided money, the-"
83,Biden,"Well, masks make a big difference. His own head of the CDC said if we just wore masks between now, if everybody wore a mask and social distanced between now and January, we'd probably save up to 100,000 lives. It matters. It matters."
84,Biden,No serious person has said the opposite. No serious person.
85,Biden,He did not say the opposite.
86,Biden,"By the way, did you see one of the last big rallies he had? A reporter came up to him to ask him a question, he said, No, no, no. Stand back, put on your mask, put on a mask. Have you been tested? I'm way far away from those other people. That's what he said, I'm going to be okay. He's not worried about you. He's not worried about the people out there  ."
87,Biden,No negative effect. Come on.
88,Biden,"Yes, I would. He's been totally irresponsible the way in which he has handled the social distancing and people wearing masks, basically encouraged them not to. He's a fool on this."
89,Biden,"The difference is millionaires and billionaires like him in the middle of the COVID crisis have done very well. Billionaires have made another $300 billion because of his profligate tax proposal, and he only focused on the market. But you folks at home, you folks living in Scranton and Claymont and all the small towns and working class towns in America, how well are you doing? This guy paid a total of $750 in taxes."
90,Biden,"Do I get my time back? The fact is that he has in fact, worked on this in a way that he's going to be the first president of the United States to leave office, having fewer jobs in his administration than when he became president. Fewer jobs than when he became president. First one in American history."
91,Biden,"Secondly, the people who have lost their jobs are those people who have been on the front lines. Those people who have been saving our lives, those people who have been out there dying. People who've been putting themselves in the way to make sure that we could all try to make it. And the idea that he is insisting that we go forward and open when you have almost half the states in America with a significant increase in COVID deaths and COVID cases in the United States of America, and he wants to open it up more. Why is he want to open it up? Why does he take care of the... You can't fix the economy until you fix the COVID crisis. And he has no intention of doing anything about making it better for you all at home in terms of your health and your safety."
92,Biden,"Schools. Why aren't schools open? Because it costs a lot of money to open them safely. They were going to give, his administration going to give the teachers and school students masks, and then they decided no, couldn't do that because it's not a national emergency. Not a national emergency. They've done nothing to help small businesses. Nothing. They're closing. One in six is now gone. He ought to get on the job and take care of the needs of the American people so we can open safely."
93,Biden,People want to be safe.
94,Biden,People want to be safe.
95,Biden,Show us your tax returns.
96,Biden,Show us your tax returns.
97,Biden,Release your tax return.
98,Biden,When?
99,Biden,In  ?
100,Biden,"Yeah, I do want to respond. Look, the tax code that put him in a position that he pays less tax than on the money a school teacher makes is because of him... He says he's smart because he can take advantage of the tax code. And he does take advantage of the tax code. That's why I'm going to eliminate the Trump tax cuts. And I'm going to eliminate those tax cuts."
101,Biden,And make sure that we invest in the people who in fact need the help. People out there need help.
102,Biden,Because you weren't president-
103,Biden,Because you weren't president and screwing things up.
104,Biden,You're the worst president America has ever had. Come on.
105,Biden,"Well, just take a look at what is the analysis done by Wall Street firms, points out that my economic plan would create 7 million more jobs than his in four years, number one. And number two, it would create an additional $1 trillion in economic growth, because it would be about buying American. The federal government spends $600 billion a year on everything from ships, to steel, to buildings and the like. And under my proposal, we're going to make sure that every penny of that has to be made by a company-"
106,Biden,"By the way, I'm going to eliminate a significant number of the taxes. I'm going to make the corporate tax 28%. It shouldn't be 21%. You have 91 companies federal, I mean, the fortune 500, who don't pay a single penny in tax making billions of dollars."
107,Biden,"Because you in fact passed that, that was your tax proposal."
108,Biden,"Yeah, you got it done-"
109,Biden,The economy-
110,Biden,Let me finish.
111,Biden,Not lower tax for the American people.
112,Biden,Look-
113,Biden,"... we inherited the worst recession, short of a depression in American history. I was asked to bring it back. We were able to have an economic recovery that created the jobs you're talking about. We handed him a booming economy, he blew it."
114,Biden,He blew it.
115,Biden,"Yeah, because what he did, even before COVID, manufacturing went in the hole. Manufacturing went in a hole-"
116,Biden,... number one. Number two-
117,Biden,Number three.
118,Biden,No.
119,Biden,This guy-
120,Biden,We did not.
121,Biden,I'm the guy that brought back the automobile industry.
122,Biden,"I was asked to bring back Chrysler and General Motors. He brought them back right here in the state of Ohio and Michigan. He blew it. They're gone. He blew it. And in fact, they're gone-"
123,Biden,That is not true.
124,Biden,And so you take a look at what he's actually done. He's done very little. His trade deals are the same way. He talks about these great trade deals. He talks about the art of the deal. China's perfected the art of the steel. We have a higher deficit with China now than we did before. We have the highest trade deficit-
125,Biden,... with Mexico.
126,Biden,That is not true.
127,Biden,None of that is true.
128,Biden,None of that is true.
129,Biden,Is totally-
130,Biden,Totally discredited. Totally discredited. And by the way-
131,Biden,Mr. Vice-
132,Biden,That is not true.
133,Biden,It is not a fact.
134,Biden,It's been totally discredited.
135,Biden,My son did nothing wrong at Barisma-
136,Biden,"He doesn't want to let me answer, because he knows I have the truth. His position has been totally thoroughly discredited-"
137,Biden,And you can-
138,Biden,"by everybody. Well, by the media, by our allies."
139,Biden,By the World Bank-
140,Biden,"By everyone, has discredited. And matter of fact   Matter of fact-"
141,Biden,Even the people who testified under oath-
142,Biden,Even the people under-
143,Biden,... testified under oath in his administration said I did my job and I did it very well.
144,Biden,I did it honorably.
145,Biden,"Well, I'll give you the list of the people who-"
146,Biden,"I'm sure that you've already fired most of them, because they did a good job."
147,Biden,"Well, here's the-"
148,Biden,"Well, it's hard to get any word in with this clown. Excuse me, this person."
149,Biden,"No, no. Mr. President-"
150,Biden,That is simply not true.
151,Biden,"Look, here's the deal. We want to talk about families and ethics. I don't want to do that. I mean, his family, we could talk about all night. His family's already-"
152,Biden,And that's such a-
153,Biden,"This is not about my family or his family. It's about your family, the American people.   That's not true. It doesn't want to talk about what you need. You, the American people, it's about you. That's what we're talking about here."
154,Biden,He didn't take that.
155,Biden,Try to be honest.
156,Biden,That is absolutely not true.
157,Biden,That's a good point.
158,Biden,"It's about equity and equality. It's about decency. It's about the constitution. And we have never walked away from trying to require equity for everyone, equality for the whole of America. But we've never accomplished it, but we've never walked away from it like he has done. It is true, the reason I got in the race is when those people... Close your eyes, remember what those people look like coming out of the fields, carrying torches, their veins bulging, just spewing anti-Semitic bile and accompanied by the Ku Klux Klan. A young woman got killed and they asked the president what he thought. He said, There were very fine people on both sides. No president's ever said anything like that.  ."
159,Biden,Now-
160,Biden,"... second point I'd make to you, is that when Floyd was killed, when Mr. Floyd was killed, there was a peaceful protest in front of the White House. What did he do? He came out of his bunker, had the military use tear gas on them so he could walk across to a church and hold up a Bible. And then what happened after that? The Bishop of that very church said that it was a disgrace. The general who was with him said all he ever wants to do is divide people, not unite people at all. This is a president who has used everything as a dog whistle, to try to generate racists hatred, racist division."
161,Biden,"This is a man who, in fact, you talk about helping African-Americans, one in 1000 African Americans has been killed because of the coronavirus. And if he doesn't do something quickly, by the end of the year, one in 500 will have been killed. One in 500 African Americans. This man is as a savior of African-Americans? This man cares at all? This man's done virtually nothing. Look, the fact is that you have to look at what he talks about. You have to look at what he did. And what he did has been disastrous for the African-American community."
162,Biden,I've never said-
163,Biden,"Yes, there is. There's systemic injustice in this country, in education and work and in law enforcement and the way in which it's enforced. But look, the vast majority of police officers are good, decent, honorable men and women. They risk their lives every day to take care of us, but there are some bad apples. And when they occur, when they find them, they have to be sorted out. They have to be held accountable. They have to be held accountable. And what I'm going to do as President of the United States is call together an entire group of people at the White House, everything from the civil rights groups, to the police officers, to the police chiefs, and we're going to work this out."
164,Biden,"We're going to work this out. So we changed the way in which we have more transparency, in when these things happen. These cops aren't happy to see what happened to George Floyd. These cops aren't happy to see what happened to Breonna Taylor. Most don't like it, but we have to have a system where people are held accountable when... And by the way, violence in response is never appropriate, never appropriate. Peaceful protest is, violence is never appropriate."
165,Biden,That is not peaceful protest.
166,Biden,Nobody's doing that. He's the racist.
167,Biden,Here's the deal. I know a lot more about this-  .
168,Biden,"The fact is that there is racial insensitivity. People have to be made aware of what other people feel like, what insults them, what is demeaning to them. It's important people know. Many people don't want to hurt other people's feelings, but it makes a big difference. It makes a gigantic difference in the way a child is able to grow up and have a sense of self-esteem. It's a little bit like how this guy and his friends look down on so many people. They look down their nose on people like Irish Catholics, like me, who grow up in Scranton. They look down on people who don't have money. They look down on people who are of a different faith. They looked down on people who are a different color. In fact, we're all Americans. The only way we're going to bring this country together is bring everybody together. There's nothing we cannot do, if we do it together. We can take this on and we can defeat racism in American."
169,Biden,Oh my Lord.
170,Biden,This is ridiculous.
171,Biden,Absolutely ridiculous.
172,Biden,Violent crime-
173,Biden,I'm in favor of law. You-  .
174,Biden,"Law and order with justice, where people get treated fairly."
175,Biden,"And the fact of the matter is, violent crime went down 17%, 15% in our administration. It's gone up on his watch."
176,Biden,He wouldn't know a suburb unless you took a wrong turn.
177,Biden,"I was raised in the suburbs. This is not 1950. All these dog whistles and racism don't work anymore. Suburbs are by and large integrated. There's many people today driving their kids to soccer practice and/or black and white and Hispanic in the same car as there have been any time in the past, what really is a threat to the suburbs and their safety is his failure to deal with COVID. They're dying in the suburbs. His failure to deal with the environment, they're being flooded, they're being burned out because his refusal to do anything. That's why the suburbs are in trouble."
178,Biden,"Look, what I support are the police having the opportunity to deal with the problems they face and I'm totally opposed to defunding the police offices. As a matter of fact police, local police, the only one defunding in his budget calls for a $400 million cut in local law enforcement assistance. They need more assistance. They need when they show up for a 9-11 call to have someone with them as a psychologist or psychiatrist to keep them from having to use force and be able to talk people down. We have to have community policing like we had before where the officers get to know the people in the communities. That's when crime went down, it didn't go up. It went down. And so we have to be..."
179,Biden,That is not true.
180,Biden,That's not true.
181,Biden,We don't have time to do anything.
182,Biden,I don't hold public office. Now I am a former vice president. I've made it clear. I've made it clear in my public statements that the violence should be prosecuted. It should be prosecuted and anyone who committed it should be prosecuted.
183,Biden,They can in fact take care of it if he just stay out of the way.
184,Biden,"And by the way his own former spokesperson said, Riots and chaos and violence help he cause. That's what this is all about."
185,Biden,I do.
186,Biden,I think Kellyanne Conway.
187,Biden,She said that.
